corpus_id,document_id,sentence_id,content
PoemBO,1,1,I am silver and exact. I have no preconceptions.
PoemBO,1,2,"What ever you see I swallow immediately Just as it is, unmisted by love or dislike."
PoemBO,1,3,"I am not cruel, only truthful—"
PoemBO,1,3,"The eye of a little god, four-cornered. "
PoemBO,1,4,"Most of the time I meditate on the opposite wall. It is pink, with speckles."
PoemBO,1,5,I have looked at it so long I think it is a part of my heart.
PoemBO,1,6,But it flickers. 
PoemBO,1,7,Faces and darkness separate us over and over. 
PoemBO,1,8,Now I am a lake. 
